{
  "imgsrc": "https://cousquer.github.io/apereo2017/assets/artworks/apereo-uportal.jpg",
  "title": "What is uPortal?",
  "time": "June 13, 2018",
  "linkMenu1": {
    "id": "museum-menu-item-1",
    "cssClass": "share-icon lightblue",
    "glyphicon": "brands/twitter.svg",
    "iconColor": "icon-white",
    "label": "Twitter: uPortal",
    "link": "https://twitter.com/uPortal",
    "name": "Twitter: uPortal"
  },
  "linkMenu2": {
    "id": "museum-menu-item-2",
    "cssClass": "share-icon strongblue",
    "glyphicon": "solid/envelope.svg",
    "iconColor": "icon-white",
    "label": "Contact",
    "link": "mailto:uportal-user@apereo.org",
    "name": "Contact"
  },
  "linkMenu3": {
    "id": "museum-menu-item-3",
    "cssClass": "share-icon black",
    "glyphicon": "brands/github.svg",
    "iconColor": "icon-white",
    "label": "Github: uPortal",
    "link": "https://github.com/jasig/uPortal",
    "name": "Github: uPortal"
  },
  "List": [{ "tag": "Open source" }, { "tag": "Apereo" }, { "tag": "Portal" }],
  "paragraphs": [
    {
      "para": "<a href='http://www.apereo.org/uportal' rel='noreferrer noopener' target='_blank'>uPortal</a> is a free and open source Java-implemented web portal platform developed and maintained by participants drawn from across higher education under the coordination of <a href='http://www.apereo.org/' rel='noreferrer noopener' target='_blank'>Apereo</a>. uPortal can aggregate content, present self-service applications, personalize presentation and content on the basis of groups and user attributes, drive mobile device applications, and allow advanced end-user-participatory customization of the portal experience. uPortal supports the JSR-286 and JSR-168 Java portlet specification for including your custom applications within the portal."
    },
    { "para": "Welcome to uPortal." }
  ],
  "button1": {
    "id": "museum-button-1",
    "cssClass": "btn btn-default btn-lg",
    "glyphicon": "brands/github.svg",
    "iconColor": "icon-black",
    "label": "Check the sources on Github",
    "link": "https://github.com/jasig/uportal-start",
    "name": "uPortal-Start"
  },
  "button2": {
    "id": "museum-button-2",
    "cssClass": "btn btn-danger btn-lg",
    "glyphicon": "solid/book.svg",
    "iconColor": "icon-white",
    "label": "English Documentation",
    "link": "http://jasig.github.io/uPortal/",
    "name": "Manual"
  }
}
